{"schema":"nrm.customer.assessment_response.v1","messageId":"assess-001","timestamp":"2026-08-13T10:00:01+08:00","source":"NRM","data":{"taskId":"task-001","reachable":true,"canEstablish":true,"canComplete":true,"primaryRoute":["fighter-01","command-01"],"bandwidthMarginBps":174000,"delayMarginMs":280,"pdrMarginPercent":6,"reasonCodes":[],"recommendations":["保持当前Link-16直连路由"]}}
